{
  "$schema": "https://json-schema.org/draft/2020-12/schema",
  "title": "M1 legacy authority bare-enumeration manifest",
  "type": "object",
  "additionalProperties": false,
  "required": [
    "schema_version",
    "mode",
    "complete",
    "entries"
  ],
  "properties": {
    "schema_version": {
      "const": 1
    },
    "mode": {
      "const": "bare-enumeration"
    },
    "complete": {
      "const": false
    },
    "entries": {
      "type": "array",
      "items": {
        "type": "object",
        "additionalProperties": false,
        "required": [
          "path",
          "owner_area",
          "sha256",
          "detected_references"
        ],
        "properties": {
          "path": {
            "type": "string"
          },
          "owner_area": {
            "type": "string"
          },
          "sha256": {
            "type": "string",
            "pattern": "^[a-f0-9]{64}$"
          },
          "detected_references": {
            "type": "array",
            "items": {
              "type": "string"
            }
          }
        }
      }
    }
  }
}
