{
  "schema_version": 1,
  "mode": "bare-enumeration",
  "complete": false,
  "entries": [
    {
      "path": "AGENTS.md",
      "owner_area": "root-agent-entrypoint",
      "sha256": "43a7a7aa3b08202dd57283963830635c737abedf72a985cd3211271c17a9b21e",
      "detected_references": [
        ".agents/skills/go/SKILL.md",
        ".agents/skills/source-command-end-session/SKILL.md",
        ".github/workflows/ci.yml",
        "CLAUDE.md",
        "README.md",
        "REVIEW.md",
        "archive/sessions/2026-08-31-m1-clean-extraction-review-claude.md",
        "archive/sessions/2026-08-31-m1-parallel-sequencing-review-claude.md",
        "archive/sessions/2026-08-31-repo-native-operating-model-m1-review-claude.md",
        "archive/sessions/2026-09-01-decision-collision-identity-plan.md",
        "archive/sessions/2026-09-01-decision-collision-resolution-plan-DEC-20260502-A.md",
        "archive/sessions/2026-09-01-m2-capability-onboarding-authority-gaps.md",
        "archive/sessions/2026-09-01-m2-capability-onboarding-decision-plan.md",
        "archive/sessions/2026-09-01-m2-capability-onboarding-decision-review-codex.md",
        "archive/sessions/2026-09-01-m2-deploy-safety-decision-plan.md",
        "archive/sessions/2026-09-01-m2-deploy-safety-decision-review-codex.md",
        "archive/sessions/2026-09-01-m2-enforcement-protocol-source-gaps.md",
        "archive/sessions/2026-09-01-m2-governance-reference-data-decision-plan.md",
        "archive/sessions/2026-09-01-m2-governance-reference-data-decision-review-codex.md",
        "archive/sessions/2026-09-01-m2-product-state-claim-matrix.json",
        "archive/sessions/2026-09-01-m2-product-state-reconciliation.md",
        "archive/sessions/2026-09-01-m2-source-enumeration-authority-gaps.md",
        "archive/sessions/2026-09-01-m2-source-enumeration-decision-plan.md",
        "archive/sessions/2026-09-01-m2-source-enumeration-decision-review-codex.md",
        "archive/sessions/2026-09-01-m2-vendor-evaluation-decision-plan.md",
        "archive/sessions/2026-09-01-m2-vendor-evaluation-decision-review-codex.md",
        "archive/sessions/2026-09-01-m2-vendor-stack-authority-gaps.md",
        "archive/sessions/2026-09-01-m2-vendor-stack-authority-plan.md",
        "archive/sessions/2026-09-02-fresh-session-readiness-plan.md",
        "archive/sessions/2026-09-02-t12-research-contract-plan.md",
        "archive/sessions/2026-09-02-t13-design-tokens-plan.md",
        "archive/sessions/2026-09-02-t14-cheap-extras-plan.md",
        "archive/sessions/2026-09-02-t15-receipts-and-migration-ledger-plan.md",
        "archive/sessions/2026-09-02-t3-session-end-gate-plan.md",
        "archive/sessions/2026-09-02-t5-cto-readable-structure-plan.md",
        "archive/sessions/2026-09-04-m2-cross-surface-DEC-20260422-A-gaps.md",
        "archive/sessions/2026-09-05-m2-closing-review-round-1.md",
        "archive/sessions/2026-09-05-m2-closing-review-round-10.md",
        "archive/sessions/2026-09-05-m2-closing-review-round-11.md",
        "archive/sessions/2026-09-05-m2-closing-review-round-12.md",
        "archive/sessions/2026-09-05-m2-closing-review-round-13.md",
        "archive/sessions/2026-09-05-m2-closing-review-round-14.md",
        "archive/sessions/2026-09-05-m2-closing-review-round-15.md",
        "archive/sessions/2026-09-05-m2-closing-review-round-2.md",
        "archive/sessions/2026-09-05-m2-closing-review-round-3.md",
        "archive/sessions/2026-09-05-m2-closing-review-round-4.md",
        "archive/sessions/2026-09-05-m2-closing-review-round-5.md",
        "archive/sessions/2026-09-05-m2-closing-review-round-6.md",
        "archive/sessions/2026-09-05-m2-closing-review-round-7.md",
        "archive/sessions/2026-09-05-m2-closing-review-round-8.md",
        "archive/sessions/2026-09-05-m2-closing-review-round-9.md",
        "archive/sessions/2026-09-06-agent-hook-setup/VERIFICATION-NOTES.md",
        "archive/sessions/2026-09-11-m3-milestone-review.md",
        "archive/sessions/2026-09-11-m3-remaining-scope-inventory.md",
        "archive/sessions/2026-09-11-m4-cutover-inventory.md",
        "archive/sessions/audit-output/parallel-audits-2026-08-12/enforcement-inventory.md",
        "archive/sessions/audit-output/parallel-audits-2026-08-12/scripts-rightsizing.md",
        "docs/operations/operator-actions.yaml",
        "docs/programs/cto-readiness/PROGRAM.md",
        "docs/programs/cto-readiness/tracks.yaml",
        "docs/strategy/2026-08-16-codebase-quality-program.md",
        "docs/strategy/2026-08-31-notion-consumer-migration-inventory.md",
        "docs/strategy/2026-08-31-repo-native-operating-model-migration.md",
        "docs/strategy/2026-09-05-brand-direction-adoption.md",
        "docs/strategy/2026-10-23-data-access-risk-rule-proposal.md",
        "docs/strategy/2026-10-23-way-of-working-review.md",
        "handoff/_general/from-code/2026-05-18-pii-fixture-audit-legal-representatives.md",
        "handoff/_general/from-code/2026-05-18-uk-ubo-smoke-eu30-reaudit-directors-verification.md",
        "handoff/_general/from-code/2026-06-24-llm-json-truncation-fix.md",
        "handoff/_general/from-code/2026-08-09-usage-analysis-capability-buildout.md",
        "handoff/_general/from-code/2026-08-12-readiness-p0-baseline.md",
        "handoff/_general/from-code/2026-08-12-readiness-p2-p3-parallel-audits.md",
        "handoff/_general/from-code/2026-08-18-quality-program-phase4-close.md",
        "handoff/_general/from-code/2026-08-31-repo-native-operating-model-m1.md",
        "handoff/_general/from-code/2026-09-01-m2-capability-onboarding-decision-chain.md",
        "handoff/_general/from-code/2026-09-01-m2-decision-authority-graph.md",
        "handoff/_general/from-code/2026-09-01-m2-deploy-safety-decision-batch.md",
        "handoff/_general/from-code/2026-09-01-m2-doctrine-decision-batch.md",
        "handoff/_general/from-code/2026-09-01-m2-governance-reference-data-decision-batch.md",
        "handoff/_general/from-code/2026-09-01-m2-source-enumeration-decision-chain.md",
        "handoff/_general/from-code/2026-09-01-m2-vendor-evaluation-decision-and-methodology.md",
        "handoff/_general/from-code/2026-09-02-t12-research-contract.md",
        "handoff/_general/from-code/2026-09-02-t13-design-tokens.md",
        "handoff/_general/from-code/2026-09-02-t14-cheap-extras.md",
        "handoff/_general/from-code/2026-09-02-t3-session-end-gate.md",
        "handoff/_general/from-code/2026-09-02-t5-cto-readable-structure.md",
        "handoff/_general/from-code/2026-09-04-m2-batch-12-vendors-registries.md",
        "handoff/_general/from-code/2026-09-04-m2-batch-14-founding-week-two.md",
        "handoff/_general/from-code/2026-09-04-m2-batch-6-provenance-jurisdiction.md",
        "handoff/_general/from-code/2026-09-04-m2-batch-9-trust-display.md",
        "handoff/_general/from-code/2026-09-05-brand-direction-applications.md",
        "handoff/_general/from-code/2026-09-05-m2-g2-batch-2-collisions.md",
        "handoff/_general/from-code/2026-09-05-m2-g2-batch-3-collisions.md",
        "handoff/_general/from-code/2026-09-05-m2-g2-batch-4-collisions.md",
        "handoff/_general/from-code/2026-09-05-m2-g2-batch-5-collisions.md",
        "handoff/_general/from-code/2026-09-05-m2-quote-fidelity-checker.md",
        "handoff/_general/from-code/2026-09-05-m2-register-tests-synthetic-collision.md",
        "handoff/_general/from-code/2026-09-06-agent-hook-setup.md",
        "handoff/_general/from-code/2026-09-06-t10-g9-closing-review-round-7.md",
        "handoff/_general/from-code/2026-10-17-checkin-morning.md",
        "handoff/_general/from-code/2026-10-23-data-access-rule-proposal.md",
        "handoff/_general/from-code/2026-10-23-positioning-decision.md",
        "handoff/_general/from-code/2026-10-23-way-of-working-review.md",
        "handoff/_general/from-code/2026-10-24-data-access-citations.md",
        "handoff/_general/from-code/2026-10-24-wow-step4-review-md.md",
        "scripts/candidates.test.mjs",
        "scripts/m2-closure-register-lib.mjs",
        "scripts/m2-quote-fidelity.mjs",
        "scripts/protocol-coverage-lib.mjs"
      ]
    },
    {
      "path": "CLAUDE.md",
      "owner_area": "root-agent-entrypoint",
      "sha256": "12fa5fdad68a6cc340ed1eb0549ec6be180b336635a42ddab2fcd6c9406d9b0d",
      "detected_references": [
        ".agents/skills/onboard-capability/SKILL.md",
        ".agents/skills/source-command-end-session/SKILL.md",
        ".claude/PROTOCOL.md",
        ".claude/RUNBOOK.md",
        ".claude/commands/end-session.md",
        ".claude/skills/go/SKILL.md",
        ".claude/skills/onboard-capability/SKILL.md",
        ".github/workflows/ci.yml",
        ".gitignore",
        "AGENTS.md",
        "README.md",
        "REVIEW.md",
        "apps/api/scripts/convert-browserless-suites-to-fixture.ts",
        "apps/api/scripts/npm-release-resolve.mjs",
        "apps/api/scripts/session-close-check.ts",
        "apps/api/src/capabilities/guarded-executor.ts",
        "apps/api/src/capabilities/serper-input-validation.test.ts",
        "apps/api/src/db/seed-solutions.test.ts",
        "apps/api/src/jobs/capability-promotion.test.ts",
        "apps/api/src/jobs/invariant-checker.ts",
        "apps/api/src/jobs/quality-floor.test.ts",
        "apps/api/src/jobs/settlement-reconciler.test.ts",
        "apps/api/src/lib/browserless-suite-migration.ts",
        "apps/api/src/lib/claude-md-protocols.test.ts",
        "apps/api/src/lib/cost-class-invariant.ts",
        "apps/api/src/lib/data-retention-backlog.test.ts",
        "apps/api/src/lib/data-retention.test.ts",
        "apps/api/src/lib/job-coordinator-interval-change.test.ts",
        "apps/api/src/lib/migration-artifact-audit.ts",
        "apps/api/src/lib/onboard-dependency-health.ts",
        "apps/api/src/lib/platform-refusal-breaker.test.ts",
        "apps/api/src/lib/schema-validator.ts",
        "apps/api/src/lib/solution-gate.test.ts",